{
  "$schema": "https://json-schema.org/draft/2020-12/schema",
  "$id": "https://schemas.sovereignops.local/canonical-events/event-catalog.schema.json",
  "title": "Canonical local event catalog",
  "type": "object",
  "additionalProperties": false,
  "required": [
    "schemaVersion",
    "generatedAt",
    "workspaceId",
    "localOnly",
    "events"
  ],
  "properties": {
    "schemaVersion": {
      "type": "string",
      "const": "canonical-local-event-catalog/v1"
    },
    "generatedAt": {
      "type": "string",
      "pattern": "^\\d{4}-\\d{2}-\\d{2}T\\d{2}:\\d{2}:\\d{2}(?:\\.\\d{3})?Z$"
    },
    "workspaceId": {
      "type": "string",
      "pattern": "^wsp_[A-Za-z0-9_-]{1,88}$"
    },
    "localOnly": {
      "type": "boolean",
      "const": true
    },
    "events": {
      "type": "array",
      "minItems": 1,
      "items": {
        "$schema": "https://json-schema.org/draft/2020-12/schema",
        "$id": "https://schemas.sovereignops.local/canonical-events/event.schema.json",
        "title": "Canonical local event",
        "type": "object",
        "additionalProperties": false,
        "required": [
          "schemaVersion",
          "id",
          "workspaceId",
          "actorId",
          "sequence",
          "occurredAt",
          "recordedAt",
          "localOnly",
          "operation",
          "payload",
          "payloadDigest",
          "previousDigest",
          "redactionMetadata"
        ],
        "properties": {
          "schemaVersion": {
            "type": "string",
            "const": "canonical-local-event/v1"
          },
          "id": {
            "type": "string",
            "pattern": "^evt_[A-Za-z0-9_-]{1,88}$"
          },
          "workspaceId": {
            "type": "string",
            "pattern": "^wsp_[A-Za-z0-9_-]{1,88}$"
          },
          "actorId": {
            "type": "string",
            "pattern": "^act_[A-Za-z0-9_-]{1,88}$"
          },
          "sequence": {
            "type": "integer",
            "minimum": 1
          },
          "occurredAt": {
            "type": "string",
            "pattern": "^\\d{4}-\\d{2}-\\d{2}T\\d{2}:\\d{2}:\\d{2}(?:\\.\\d{3})?Z$"
          },
          "recordedAt": {
            "type": "string",
            "pattern": "^\\d{4}-\\d{2}-\\d{2}T\\d{2}:\\d{2}:\\d{2}(?:\\.\\d{3})?Z$"
          },
          "localOnly": {
            "type": "boolean",
            "const": true
          },
          "operation": {
            "type": "string",
            "enum": [
              "append",
              "update",
              "delete",
              "approval_requested",
              "approval_approved",
              "approval_rejected"
            ]
          },
          "payload": {
            "$schema": "https://json-schema.org/draft/2020-12/schema",
            "title": "Canonical local event payload",
            "type": "object",
            "additionalProperties": false,
            "required": [
              "schemaKind",
              "recordId",
              "summary"
            ],
            "properties": {
              "schemaKind": {
                "type": "string",
                "enum": [
                  "docs",
                  "projects",
                  "incidents",
                  "comments",
                  "attachments",
                  "approvals"
                ]
              },
              "recordId": {
                "type": "string",
                "pattern": "^(?:doc|prj|inc|cmt|att|apv)_[A-Za-z0-9_-]{1,88}$"
              },
              "targetId": {
                "type": "string",
                "pattern": "^(?:doc|prj|inc|cmt|att|apv)_[A-Za-z0-9_-]{1,88}$"
              },
              "summary": {
                "type": "string",
                "minLength": 1,
                "pattern": "\\S"
              },
              "beforeDigest": {
                "type": "string",
                "pattern": "^[a-f0-9]{64}$"
              },
              "afterDigest": {
                "type": "string",
                "pattern": "^[a-f0-9]{64}$"
              },
              "fields": {
                "type": "array",
                "minItems": 1,
                "items": {
                  "type": "string",
                  "minLength": 1,
                  "pattern": "^[A-Za-z][A-Za-z0-9_.\\[\\]-]{0,191}$"
                }
              },
              "approvalId": {
                "type": "string",
                "pattern": "^apv_[A-Za-z0-9_-]{1,88}$"
              },
              "approvalStatus": {
                "type": "string",
                "enum": [
                  "requested",
                  "approved",
                  "rejected"
                ]
              },
              "decision": {
                "type": "string",
                "enum": [
                  "approved",
                  "rejected"
                ]
              }
            }
          },
          "payloadDigest": {
            "type": "string",
            "pattern": "^[a-f0-9]{64}$"
          },
          "previousDigest": {
            "type": [
              "string",
              "null"
            ],
            "pattern": "^[a-f0-9]{64}$"
          },
          "redactionMetadata": {
            "$schema": "https://json-schema.org/draft/2020-12/schema",
            "title": "Canonical local event redaction metadata",
            "type": "object",
            "additionalProperties": false,
            "required": [
              "redacted",
              "redactedFieldCount",
              "redactedPaths",
              "retainedMetadataKeys"
            ],
            "properties": {
              "redacted": {
                "type": "boolean"
              },
              "redactedFieldCount": {
                "type": "integer",
                "minimum": 0
              },
              "redactedPaths": {
                "type": "array",
                "items": {
                  "type": "string",
                  "minLength": 1,
                  "pattern": "^[A-Za-z][A-Za-z0-9_.\\[\\]-]{0,191}$"
                }
              },
              "retainedMetadataKeys": {
                "type": "array",
                "items": {
                  "type": "string",
                  "minLength": 1,
                  "pattern": "^(?!.*(?:[aA][pP][iI][_-]?[kK][eE][yY]|[aA][uU][tT][hH][oO][rR][iI][zZ][aA][tT][iI][oO][nN]|[bB][eE][aA][rR][eE][rR]|[cC][rR][eE][dD][eE][nN][tT][iI][aA][lL]|[pP][aA][sS][sS][wW][oO][rR][dD]|[pP][rR][iI][vV][aA][tT][eE][_-]?[kK][eE][yY]|[rR][aA][wW]|[sS][eE][cC][rR][eE][tT]|[tT][oO][kK][eE][nN]))[A-Za-z][A-Za-z0-9_.-]{0,63}$"
                }
              }
            }
          }
        }
      }
    }
  }
}
